subgraph,sentence
<S> <H> disproportionate impact on groups <POS> <T> suicidal thoughts <H> disproportionate impact on groups <POS> <T> attempts <H> disproportionate impact on groups <POS> <T> suicide <H> factors affecting risk <NEG> <T> males suicide <H> factors affecting risk <NEG> <T> females suicide attempts <H> factors affecting risk <NEG> <T> middle-aged and older adults suicide <H> factors affecting risk <NEG> <T> people living with a mental health disorder <H> factors affecting risk <NEG> <T> people who have previously attempted suicide <H> factors affecting risk <NEG> <T> people with a history of non-suicidal self-injury <H> factors affecting risk <NEG> <T> veterans and active-duty military personnel <H> factors affecting risk <NEG> <T> individuals who are institutionalized <H> factors affecting risk <NEG> <T> people with exposure to adverse childhood experiences <H> factors affecting risk <NEG> <T> violence <H> factors affecting risk <NEG> <T> or traumatic stress <H> factors affecting risk <NEG> <T> people experiencing unstable housing <H> factors affecting risk <NEG> <T> individuals with substance use disorders <H> factors affecting risk <NEG> <T> individuals of sexual and gender minority status <H> factors affecting risk <NEG> <T> some displaced persons or refugees <H> factors affecting risk <NEG> <T> people with lower incomes <H> factors affecting risk <NEG> <T> non-Hispanic American Indian or Alaska Native <H> factors affecting risk <NEG> <T> non-Hispanic Black <H> factors affecting risk <NEG> <T> non-Hispanic White adolescents and young adults <E>,"Groups disproportionately impacted by suicidal thoughts, attempts, and/or suicide include: males (suicide), females (suicide attempts), middle-aged and older adults (suicide), people living with a mental health disorder, people who have previously attempted suicide, people with a history of non-suicidal self-injury, veterans and active-duty military personnel, individuals who are institutionalized, people with exposure to adverse childhood experiences, violence, or traumatic stress, people experiencing unstable housing, individuals with substance use disorders, individuals of sexual and gender minority status, some displaced persons or refugees, people with lower incomes, and some racial and ethnic groups, including non-Hispanic American Indian or Alaska Native, non-Hispanic Black, and non-Hispanic White adolescents and young adults."
<S> <H> participation in fbp <POS> <T> significantly less suicidal ideation <H> participation in fbp <POS> <T> fewer suicide attempts at 6-year and 15-year follow-ups <E>,It reports significantly less suicidal ideation and fewer suicide attempts at 6-year and 15-year follow- ups among children who participated in FBP when compared with a group of children who have lost a parent to suicide but did not participate in FBP.
<S> <H> safe storage of medications <POS> <T> firearms <H> safe storage of medications <POS> <T> and other household products <H> safe storage of medications <NEG> <T> the risk for suicide <E>,"Safe storage of medications, firearms, and other household products can reduce the risk for suicide by separating individuals at elevated risk of suicide from easy access to lethal means."
<S> <H> stigma surrounding mental health concerns <POS> <T> depression <H> stigma surrounding mental health concerns <POS> <T> anxiety <H> stigma surrounding mental health concerns <POS> <T> conduct problems <H> stigma surrounding mental health concerns <POS> <T> substance use <H> stigma surrounding mental health concerns <POS> <T> suicidal ideation <H> stigma surrounding mental health concerns <POS> <T> suicide attempts <E>,"stigma surrounding mental health concerns, depression, anxiety, conduct problems, and substance use, suicidal ideation, and suicide attempts."
<S> <H> additional research <POS> <T> engage children <H> additional research <POS> <T> connect with community members and community resources <H> additional research <NEG> <T> suicide <E>,"Additional research is warranted regarding strategies to engage children, help them connect with community members and community resources, and prevent suicide."
<S> <H> identifying and supporting people at risk for suicide <POS> <T> suicide prevention <E>,Identifying and supporting people at risk for suicide is critical to suicide prevention.
<S> <H> training and size of the mental healthcare workforce <POS> <T> access to effective and state-of-the-art mental healthcare <E>,Access to effective and state-of-the-art mental healthcare is largely dependent upon the training and the size of the mental healthcare workforce.
<S> <H> strategies and approaches to prevent the risk of suicide <POS> <T> lessening the immediate and long-term harms of suicidal behavior <E>,"It includes strategies and approaches to prevent the risk of suicide in the first place, as well as strategies focused on lessening the immediate and long-term harms of suicidal behavior."
